{
  "$schema": "https://json-schema.org/draft/2020-12/schema",
  "$id": "https://ourword.ai/skill/schema/skill.schema.json",
  "title": "品味 shelf item / Pinwei shelf item",
  "type": "object",
  "required": ["id", "kind", "name", "repo", "category"],
  "properties": {
    "id":         {"type": "string"},
    "kind":       {"enum": ["skill", "collection"]},
    "name":       {"type": "string"},
    "title_zh":   {"type": "string"},
    "tagline_zh": {"type": "string"},
    "tagline_en": {"type": "string"},
    "desc_en":    {"type": "string"},
    "why_zh":     {"type": "string"},
    "why_en":     {"type": "string"},
    "limit_zh":   {"type": "string",
                   "description": "诚实的局限：机制上的短板、平台限制、适用边界。只写这一件东西真实的坏消息，不写通用免责声明（「请自行判断」「仅供参考」不算局限）。空字符串 = 尚未写。长度是两档：目标 ≤140 字（卡片版式约束，check_curation.py 报 WARN），硬上限 210 字（超了就不是一条局限而是一段话，多半把点评或简介写进来了，报 ERROR）。",
                   "maxLength": 210},
    "limit_en":   {"type": "string",
                   "description": "Honest limitation: mechanical weakness, platform constraint, or where it stops working. Not a generic disclaimer. Empty string = not written yet. Soft target 280 chars, hard ceiling 420.",
                   "maxLength": 420},
    "limit_brief_zh": {"type": "string", "maxLength": 30,
                   "description": "卡片上那一行短版局限。**必须是完整句子、句号结尾**——不是 limit_zh 的截断，也不是摘要，是同一件事的短说法。一句完整的诚实短处被砍成前 24 字，读起来就成了勾人往下点的钩子，诚实会变成营销。取舍原则：留最能劝退错的人的那一条，不是最短的那一条。空串 = 尚未写。完整版 limit_zh 一个字不动，原样留详情页。"},
    "limit_brief_en": {"type": "string", "maxLength": 60,
                   "description": "One-line version of the limitation for the card. Must be a complete sentence, not a truncation of limit_en."},
    "repo":       {"type": "string"},
    "owner":      {"type": "string"},
    "path":       {"type": "string"},
    "url":        {"type": "string"},
    "homepage":   {"type": "string"},
    "stars":      {"type": "integer"},
    "pushed_at":  {"type": "string"},
    "skill_count":{"type": "integer"},
    "category":   {"enum": ["creative","fun","writing","life","docs","work","dev","meta"]},
    "fun_score":  {"type": "number"},
    "pick":       {"type": "boolean"},
    "hide":       {"type": "boolean"},
    "source":     {"type": "string"},
    "added_at":   {"type": "string"},
    "cover":      {"type": "string", "description": "封面图 URL；店长可在 editorial 置空否决。**必须托在作者自己的仓库域名下**（`*.githubusercontent.com` / `github.com`）—— 声称是作者产出物的图，得真是他的图；而且第三方域名意味着每个访客都要去 ping 一次那个第三方。`check_curation.py`【9】：声称是证据的 = ERROR，其余第三方 = WARN。真实教训：曾有一张 `gcdn.moonshot.cn` 的 Kimi 赞助广告标着 `artwork`+`cover_real=true` 上了站，**宽高记得完全正确所以宽高对账放过了它**。"},
    "cover_kind": {"enum": ["artwork", "ours", "hero", "diagram", "og", "other", ""],
                   "description": "这张封面**是什么**。⚠️ **它已经不是内部标记，是用户可见文案** —— 详情页的图注直接由它决定（`artwork` → 「作者仓库里的产出示例，这就是它做出来的东西」/ `hero` → 「作者自制的头图，不是产出示例」/ `diagram` → 「机制示意图，不是产出示例」）。所以**动它要当改文案来动，不是当改标记来动**：为了消掉一条警报把 `artwork` 降成 `hero`，等于改了一句给读者看的话，如果那张图既不是产出物也不是作者头图（比如一张赞助广告），改完仍然是假的。内容逐张打开看过后标的，不是字段推断：`artwork` 作者仓库里的产出物 · `ours` **我们自己装上真跑出来截的图** —— 更强的一档证据（护城河就在这儿：没有目录站真装真跑），但它必须有自己的图注，不能印成「作者仓库里的产出示例」，那是把我们做的事说成作者做的；这一档的图托在 `woowoeth/skill` 而不是作者仓库，`check_curation.py`【9】按 owner/repo 比对识别 · `hero` 作者自制宣传头图 · `diagram` 示意图 · `og` GitHub 自动生成的信息卡 · `other` logo/二维码/空白/坏图。上站规则：`artwork` 允许竖幅大画幅 `[0.6,2.0]`；`hero`/`diagram` 收到 `[1.0,2.0]`，不给竖幅；`og`/`other` 不上站。**注意力给证据，不给宣传图。** 详情页必须写清这张图是什么，卡片上不加标签——怕的是「被漂亮头图骗进去，装完发现产出不长那样」。"},
    "cover_real": {"type": "boolean",
                   "description": "**这一件实际上站的那张图**是不是产出物证据。注意它**不等价于** `cover_kind == \"artwork\"`：实测 `artwork` 有 39 件而 `cover_real` 只有 27 件，差的 12 件 `cover_kind` 是 artwork 但 `cover` 是空串（对应 D10「再扣 12 张重复」——同一张图被同仓库多件共用后去重，以内容的实现为准）。所以前端判断有没有产出物图，要看 `cover_real` **且** `cover` 非空，不要拿 `cover_kind` 推。只有逐张打开看过的数才算数：这个数报错过两次（先 97 再 79），实际 27。"},
    "cover_w":    {"type": "integer", "description": "封面像素宽。**规范名就是 `cover_w`/`cover_h`**（58 件在用）——不要再造 `cover_width`/`cover_height`，那对名字不在 schema 里，同时存在两套就是两份真相。实测踩过一次：`yangcodingmaster-photo-distill` 两套并存且互相矛盾（1600×1060 vs 1600×1066），解 JPEG 头量得真实尺寸是 **1600×1066**，即规范字段里那个是错的。"},
    "cover_h":    {"type": "integer", "description": "封面像素高。见 `cover_w`。宽高比 `cover_w/cover_h` 决定 D10 的画幅档：`artwork` [0.6,2.0]，`hero`/`diagram` [1.0,2.0]。落在区间外不是数据错，是卡片得裁剪或留白 —— 裁掉多少由 `check_curation.py`【9】算出来点名。"},
    "cover_note": {"type": "string", "description": "这张封面的人工说明：为什么换了、为什么撤了、它到底是什么。D10 要求**详情页必须写清这张图是什么**（产出物 / 作者头图 / 示意图），卡片上不加标签 —— 怕的是「被漂亮头图骗进去，装完发现产出不长那样」。人工更正过的图应当在这里留痕。"},
    "cover_dup_of": {"type": "string", "description": "这张候选图和哪一件重的（去重留痕）。同一张图被同仓库多件共用时只让一件上站，其余记这里、`cover` 留空。这就是 `cover_kind==\"artwork\"`（39 件）多于 `cover_real`（27 件）的原因。"},
    "unshelve_reason": {"type": "string",
                   "description": "下架理由。**必须写清是商品的问题还是本店的欠账**——后者（例如我们自家仓库 404）将来仓库找回就要恢复上架，两类不能混。`hide: true` 可逆，记录永远保留。"},
    "unshelved_at": {"type": "string", "pattern": "^(\\d{4}-\\d{2}-\\d{2})?$",
                   "description": "下架日期 YYYY-MM-DD。"},
    "repo_created_at": {"type": "string", "pattern": "^(\\d{4}-\\d{2}-\\d{2})?$",
                   "description": "仓库创建日（`GET /repos/{repo}` 的 created_at）。**它不一定是这件 skill 的年龄**——见 `age_source`。取不到就留空，不估算。"},
    "skill_first_seen": {"type": "string", "pattern": "^(\\d{4}-\\d{2}-\\d{2})?$",
                   "description": "这个 `path` 下最早一次提交的日期，才是**这一件** skill 的年龄。每件要两次 API 调用（commits 接口按时间倒序，得先问出总页数再取最后一页），未认证配额 60 次/小时填不满全店，所以多数会长期为空。空串 = 还没取到，**不是「没有」**。"},
    "age_source": {"enum": ["", "repo", "file"],
                   "description": "上面两个日期里**哪一个真的回答了「这件 skill 多老」**。派生字段，每次重建 feed 重算，人不写。`\"file\"` = 用 skill_first_seen，最准 · `\"repo\"` = `path` 为空、这件就是仓库本体，仓库创建时间就是它的年龄 · `\"\"` = 只有 repo_created_at 而这件长在子目录里，那是**仓库**的年龄不是**它**的年龄，**前端不显示**。第三档是关键：在架 152 件里 78 件是子目录货，实测仓库日与 skill 日差 1~111 天，而 `CURATION.md` 的准入窗是 ≤7 天 / ≤14 天——误差和我们自己的时间窗同阶，显示近似值就等于印一个答非所问的数字。"},
    "prep_badge": {"enum": ["", "ready"],
                   "description": "备料徽章。构建时从 methods/ 存档的正文算出的派生字段，不写进 skills/*.json，店长不手写。\"ready\" = 「备料齐」（≥3 条可核对的证据）；\"\" = 其余全部。**只有正向档**：1–2 条证据、0 条证据、以及根本没有正文存档，三者在 feed 里完全一致，前端拿不到任何能渲染成负面的信息 —— 见 scouts/prep_signals.py 模块头。"},
    "prep_evidence":    {"type": "array", "items": {"type": "string"},
                   "description": "备料齐时列出命中的证据（参考文件 / 可执行脚本 / 素材模板 / 边界说明 / 适用条件 / 自带评测），供前端直接显示。prep_badge 为空时必定是空数组。"},
    "prep_evidence_en": {"type": "array", "items": {"type": "string"},
                   "description": "Same evidence list in English, for llms.txt and the crawlable layer."},
    "install":    {"type": "object",
                   "description": "安装命令。**`copy` 是不是必填，取决于 `kind`：**\n\n- `kind=\"skill\"` —— `copy` 必须有值。那是用户照抄的一行，空了这件商品就是装不上，等于没上架。`check_curation.py` 判 ERROR。\n- `kind=\"collection\"` —— `copy` **允许为空**，这是刻意的。合集的 `mv <repo> ~/.claude/skills/<repo>` 落地后那一层目录里没有 SKILL.md，**装了等于没装**；而且一半合集的 skill 散在多个根目录（open-design 11 个根、codeArbiter 9 个），「那个 skills 目录」根本不存在。合集只给 `clone` + `browse` 指针，前端文案是定死的：「clone 下来，挑你要的那件复制进 `~/.claude/skills/`。**这是一个合集，没有「装它」这个动作。**」\n\n这条条件规则由 `scouts/check_curation.py` 强制 —— 那边的手写 schema 校验子集不支持 if/then，所以规则写在这里，检查在那里。",
                   "properties": {
                     "clone":  {"type": "string", "description": "git clone 命令。单品和合集都必须有。"},
                     "copy":   {"type": "string", "description": "把 skill 复制进 ~/.claude/skills/ 的那一行。单品必填；合集可为空（见上）。"},
                     "dir":    {"type": "string", "description": "装完之后 skill 所在的目录。这一层里必须直接有 SKILL.md，否则 agent 认不出来。"},
                     "browse": {"type": "string", "description": "合集专用：浏览这个合集里都有哪些 skill 的地址（一般是仓库的 tree URL）。`copy` 为空时应当给出，否则用户 clone 完不知道下一步去哪挑。"},
                     "note":   {"type": "string", "description": "合集专用的固定文案（D7 定死这一句）：「clone 下来，挑你要的那件复制进 `~/.claude/skills/`。**这是一个合集，没有「装它」这个动作。**」最后半句要留着 —— 它直接说清这张卡为什么跟别的不一样。"}
                   }}
  }
}
