{
 "id": "joeyhu1108-maker-zone-material-art",
 "kind": "skill",
 "name": "zone-material-art",
 "title_zh": "",
 "tagline_zh": "让 Claude 帮你搞创作：zone-material-art。英文简介见下。",
 "tagline_en": "",
 "desc_en": "将主题、文本、照片、空间或材料清单转化为原创材料艺术、材料蒙太奇绘画、浮雕、装置、展陈方案、图像生成提示词或审稿意见。Use when the user explicitly asks for 材料艺术、材料蒙太奇、material art、material montage、material-based artwork、/zone-material-art，或需要诊断作品为何只有随机拼贴、表面材料效果、通用符号或不可信的装置结构。不要为普通拼贴、通用抽象画、艺术家履历查询、价格咨询或与材料艺术无关的图像编辑自动触发。",
 "why_zh": "",
 "why_en": "",
 "limit_zh": "",
 "limit_en": "",
 "repo": "joeyhu1108-maker/ZONE-Material-art",
 "owner": "joeyhu1108-maker",
 "path": "",
 "url": "https://github.com/joeyhu1108-maker/ZONE-Material-art",
 "homepage": "",
 "stars": 2,
 "pushed_at": "2026-08-09T14:10:39Z",
 "skill_count": 1,
 "category": "creative",
 "fun_score": 6.27,
 "pick": false,
 "hide": true,
 "source": "human-suggested",
 "added_at": "2026-08-28",
 "install": {
  "clone": "git clone --depth 1 https://github.com/joeyhu1108-maker/ZONE-Material-art.git",
  "copy": "mv ZONE-Material-art ~/.claude/skills/zone-material-art",
  "dir": "~/.claude/skills/zone-material-art"
 }
}