{
 "id": "liangdabiao-ecom-video-seedance-prompt",
 "kind": "skill",
 "name": "ecom-video-seedance-prompt",
 "title_zh": "",
 "tagline_zh": "让 Claude 帮你搞创作：ecom-video-seedance-prompt。英文简介见下。",
 "tagline_en": "",
 "desc_en": "带货视频反向拆解与 Seedance（即梦）复刻提示词生成。当用户提供带货/电商/广告/商销/种草/千川视频（或提到即梦、Seedance、文生视频、复刻爆款、拆解视频、提示词），想分析镜头、复刻效果、生成视频提示词时，使用本skill。自动产出镜头级分镜表（景别/运镜/光影/动作时序/卖点）和符合 S-A-C-S-C 编导规范的完整提示词包（分镜头提示词+基础参数+负面词+@参考图清单），支持忠实复刻/自然流/付费流三种风格。",
 "why_zh": "",
 "why_en": "",
 "limit_zh": "",
 "limit_en": "",
 "repo": "liangdabiao/ecom-video-seedance-prompt",
 "owner": "liangdabiao",
 "path": "",
 "url": "https://github.com/liangdabiao/ecom-video-seedance-prompt",
 "homepage": "",
 "stars": 54,
 "pushed_at": "2026-08-26T00:52:57Z",
 "skill_count": 1,
 "category": "creative",
 "fun_score": 4.56,
 "pick": false,
 "hide": true,
 "source": "human-suggested",
 "added_at": "2026-08-26",
 "install": {
  "clone": "git clone --depth 1 https://github.com/liangdabiao/ecom-video-seedance-prompt.git",
  "copy": "mv ecom-video-seedance-prompt ~/.claude/skills/ecom-video-seedance-prompt",
  "dir": "~/.claude/skills/ecom-video-seedance-prompt"
 }
}