{
 "id": "zby-commonplace-cp-skill-connect",
 "kind": "skill",
 "name": "cp-skill-connect",
 "title_zh": "牵线搭桥",
 "tagline_zh": "给单个文件找隐藏关联，不碰原库不建索引，自动生成报告到 kb/reports/connect/。输入路径或名字。",
 "tagline_en": "Find hidden links for one artifact, no library changes, no index rebuild. Just a path or name, get a.",
 "desc_en": "Discover connections for a single artifact. Writes a connect-report under kb/reports/connect/<collection>/ without mutating library artifacts or indexes. Use with an artifact path or artifact name.",
 "why_zh": "同类工具常全局扫描或改动索引，它只针对单文件，零副作用，报告独立存放，适合安全探索。",
 "why_en": "Unlike global scanners, it targets one artifact, never mutates library or indexes, and writes a standalone report—safe for.",
 "repo": "zby/commonplace",
 "owner": "zby",
 "path": "kb/instructions/cp-skill-connect",
 "url": "https://github.com/zby/commonplace/tree/HEAD/kb/instructions/cp-skill-connect",
 "homepage": "",
 "stars": 88,
 "pushed_at": "2026-09-08T15:38:12Z",
 "skill_count": 1,
 "category": "docs",
 "fun_score": 1.75,
 "pick": false,
 "hide": false,
 "source": "daily-scout",
 "added_at": "2026-08-08",
 "install": {
  "clone": "git clone --depth 1 https://github.com/zby/commonplace.git",
  "copy": "cp -r commonplace/kb/instructions/cp-skill-connect ~/.claude/skills/cp-skill-connect",
  "dir": "~/.claude/skills/cp-skill-connect"
 }
}