{
 "id": "simota-planning-skills-planning-decompose",
 "kind": "skill",
 "name": "planning-decompose",
 "title_zh": "",
 "tagline_zh": "写代码的顺手工具：planning-decompose。英文简介见下。",
 "tagline_en": "",
 "desc_en": "Slicing chosen work into tasks and sequencing them: task shape, the dependency graph, the critical path, milestones, and what can run in parallel.",
 "why_zh": "",
 "why_en": "",
 "limit_zh": "",
 "limit_en": "",
 "repo": "simota/planning-skills",
 "owner": "simota",
 "path": "skills/planning-decompose",
 "url": "https://github.com/simota/planning-skills/tree/HEAD/skills/planning-decompose",
 "homepage": "",
 "stars": 1,
 "pushed_at": "2026-08-22T23:35:39Z",
 "skill_count": 1,
 "category": "dev",
 "fun_score": 0.0,
 "pick": false,
 "hide": true,
 "source": "human-suggested",
 "added_at": "2026-08-23",
 "install": {
  "clone": "git clone --depth 1 https://github.com/simota/planning-skills.git",
  "copy": "cp -r planning-skills/skills/planning-decompose ~/.claude/skills/planning-decompose",
  "dir": "~/.claude/skills/planning-decompose"
 }
}