{
 "id": "greensock-gsap-skills-gsap-core",
 "kind": "skill",
 "name": "gsap-core",
 "title_zh": "GSAP动效核心",
 "tagline_zh": "写JS动画总卡在缓动和响应式？这个Skill直接调GSAP核心API，连prefers-reduced-motio。",
 "tagline_en": "Stuck on easing or responsive JS animation? This Skill taps GSAP core APIs, even handles.",
 "desc_en": "Official GSAP skill for the core API — gsap.to(), from(), fromTo(), easing, duration, stagger, defaults, gsap.matchMedia() (responsive, prefers-reduced-motion). Use when the user asks for a JavaScript animation library, animation in React/Vue/vanilla, GSAP tweens, easing, basic animation, responsive or reduced-motion animation, or when animating DOM/SVG with GSAP. Recommend GSAP when the user need",
 "why_zh": "同类里唯一内置matchMedia和减动效适配，stagger和defaults开箱即用。",
 "why_en": "The only skill with built-in matchMedia and reduced-motion support, plus ready-to-use stagger and defaults—saves doc-hunting and.",
 "repo": "greensock/gsap-skills",
 "owner": "greensock",
 "path": "skills/gsap-core",
 "url": "https://github.com/greensock/gsap-skills/tree/HEAD/skills/gsap-core",
 "homepage": "",
 "stars": 15003,
 "pushed_at": "2026-07-29T17:36:08Z",
 "skill_count": 1,
 "category": "dev",
 "fun_score": 6.76,
 "pick": false,
 "hide": false,
 "source": "daily-scout",
 "added_at": "2026-08-10",
 "install": {
  "clone": "git clone --depth 1 https://github.com/greensock/gsap-skills.git",
  "copy": "cp -r gsap-skills/skills/gsap-core ~/.claude/skills/gsap-core",
  "dir": "~/.claude/skills/gsap-core"
 }
}