{
 "id": "aiko-it-systems-discatsharp-maintain-discatsharp",
 "kind": "skill",
 "name": "maintain-discatsharp",
 "title_zh": "DiscatSh",
 "tagline_zh": "改 DisCatSharp 源码、加 API、调序列化、跑多目标测试？它连 DocFX 文档和发布说明都包了。",
 "tagline_en": "Tweak DisCatSharp source, add APIs, fix serialization, run multi-target tests? It even handles DocFX docs and.",
 "desc_en": "Review, modify, test, document, or release the DisCatSharp repository. Use for DisCatSharp source changes, API additions and migrations, Discord payload models, serialization, command synchronization, Gateway dispatch, REST behavior, analyzer work, multi-target testing, DocFX generation, release notes, and repository pull requests.",
 "why_zh": "同类工具只改代码，它连文档生成、发布说明和 PR 流程都接管，一条龙不遗漏。",
 "why_en": "Unlike code-only tools, it also owns DocFX docs, release notes, and PR flow—no loose ends.",
 "repo": "Aiko-IT-Systems/DisCatSharp",
 "owner": "Aiko-IT-Systems",
 "path": "skills/maintain-discatsharp",
 "url": "https://github.com/Aiko-IT-Systems/DisCatSharp/tree/HEAD/skills/maintain-discatsharp",
 "homepage": "https://docs.dcs.aitsys.dev",
 "stars": 144,
 "pushed_at": "2026-09-09T17:16:13Z",
 "skill_count": 1,
 "category": "dev",
 "fun_score": 1.94,
 "pick": false,
 "hide": false,
 "source": "daily-scout",
 "added_at": "2026-08-11",
 "install": {
  "clone": "git clone --depth 1 https://github.com/Aiko-IT-Systems/DisCatSharp.git",
  "copy": "cp -r DisCatSharp/skills/maintain-discatsharp ~/.claude/skills/maintain-discatsharp",
  "dir": "~/.claude/skills/maintain-discatsharp"
 },
 "cover": "https://repository-images.githubusercontent.com/381022279/072fb64a-4716-46a9-a562-1d0ff4324350"
}