{
 "id": "ibelick-ui-skills",
 "kind": "collection",
 "name": "ui-skills",
 "title_zh": "",
 "tagline_zh": "让 Claude 帮你搞创作：ui-skills。英文简介见下。",
 "tagline_en": "",
 "desc_en": "Skills for Design Engineers",
 "why_zh": "",
 "why_en": "",
 "limit_zh": "",
 "limit_en": "",
 "repo": "ibelick/ui-skills",
 "owner": "ibelick",
 "path": "",
 "url": "https://github.com/ibelick/ui-skills",
 "homepage": "https://www.ui-skills.com/",
 "stars": 8260,
 "pushed_at": "2026-09-06T09:58:58Z",
 "skill_count": 7,
 "category": "creative",
 "fun_score": 6.53,
 "pick": false,
 "hide": true,
 "source": "chart",
 "added_at": "2026-08-29",
 "install": {
  "clone": "git clone --depth 1 https://github.com/ibelick/ui-skills.git",
  "copy": "",
  "dir": "",
  "browse": "https://github.com/ibelick/ui-skills/tree/HEAD/skills",
  "note": "clone 下来，挑你要的那件复制进 ~/.claude/skills/。这是一个合集，没有「装它」这个动作。"
 },
 "cover": "/skill/assets/covers/ibelick-ui-skills.png"
}