{
 "id": "shouna12358-png-heytea-creative-style-heytea-style",
 "kind": "skill",
 "name": "heytea-style",
 "title_zh": "",
 "tagline_zh": "",
 "tagline_en": "",
 "desc_en": "Create static 9:16 food promotional posters from uploaded photos using a pure white #FFFFFF field, a photorealistic reference-preserving food subject, one high-coverage childlike black-line narrative across the most expressive food surface, sparse motion doodles elsewhere, and optional exact Chinese copy in exactly two lettering families: F as the coarse non-dominant-hand crayon version and I as t",
 "why_zh": "",
 "why_en": "",
 "limit_zh": "",
 "limit_en": "",
 "repo": "shouna12358-png/heytea-creative-style",
 "owner": "shouna12358-png",
 "path": "heytea-creative style/skills/heytea-style",
 "url": "https://github.com/shouna12358-png/heytea-creative-style/tree/HEAD/heytea-creative style/skills/heytea-style",
 "homepage": "",
 "stars": 46,
 "pushed_at": "2026-07-19T13:02:24Z",
 "skill_count": 1,
 "category": "creative",
 "fun_score": 1.5,
 "pick": false,
 "hide": true,
 "source": "daily-scout",
 "added_at": "2026-08-28",
 "install": {
  "clone": "git clone --depth 1 https://github.com/shouna12358-png/heytea-creative-style.git",
  "copy": "cp -r heytea-creative-style/heytea-creative style/skills/heytea-style ~/.claude/skills/heytea-style",
  "dir": "~/.claude/skills/heytea-style"
 },
 "cover": "/skill/assets/covers/shouna12358-png-heytea-creative-style-heytea-style.png"
}