{
 "id": "agricidaniel-claude-seo-seo-technical",
 "kind": "skill",
 "name": "seo-technical",
 "title_zh": "SEO 九诊",
 "tagline_zh": "网站被爬虫拒之门外？九项技术体检一次查清：抓取、索引、速度、结构化数据……连 IndexNow 都帮你测。",
 "tagline_en": "Crawlers blocked? One audit covers crawl, index, speed, schema, JS, and even IndexNow—so Google finally sees your.",
 "desc_en": "Technical SEO audit across 9 categories: crawlability, indexability, security, URL structure, mobile, Core Web Vitals, structured data, JavaScript rendering, and IndexNow protocol. Use when user says \"technical SEO\", \"crawl issues\", \"robots.txt\", \"Core Web Vitals\", \"site speed\", or \"security headers\".",
 "why_zh": "同类工具只查表面，它连 JavaScript 渲染和 IndexNow 协议都测，九类问题一次定位。",
 "why_en": "Unlike shallow checkers, it digs into JS rendering and IndexNow, covering 9 technical areas in one pass—saves you hours of.",
 "repo": "AgriciDaniel/claude-seo",
 "owner": "AgriciDaniel",
 "path": "skills/seo-technical",
 "url": "https://github.com/AgriciDaniel/claude-seo/tree/HEAD/skills/seo-technical",
 "homepage": "",
 "stars": 16469,
 "pushed_at": "2026-08-26T12:16:22Z",
 "skill_count": 1,
 "category": "work",
 "fun_score": 3.8,
 "pick": false,
 "hide": false,
 "source": "handpick-0807",
 "added_at": "2026-08-07",
 "install": {
  "clone": "git clone --depth 1 https://github.com/AgriciDaniel/claude-seo.git",
  "copy": "cp -r claude-seo/skills/seo-technical ~/.claude/skills/seo-technical",
  "dir": "~/.claude/skills/seo-technical"
 },
 "cover": "https://repository-images.githubusercontent.com/1152014594/0e048e51-24ae-435b-9b32-cc6b3def5356"
}