{
 "id": "jmanhype-claude-code-plugin-marketplace-curate-delta",
 "kind": "skill",
 "name": "curate-delta",
 "title_zh": "",
 "tagline_zh": "写代码的顺手工具：curate-delta。英文简介见下。",
 "tagline_en": "",
 "desc_en": "Synthesize Reflector insights into structured delta proposals for playbook updates, following ACE paper's Curator architecture",
 "why_zh": "",
 "why_en": "",
 "limit_zh": "",
 "limit_en": "",
 "repo": "jmanhype/claude-code-plugin-marketplace",
 "owner": "jmanhype",
 "path": "plugins/ace-context-engineering/skills/curate-delta",
 "url": "https://github.com/jmanhype/claude-code-plugin-marketplace/tree/HEAD/plugins/ace-context-engineering/skills/curate-delta",
 "homepage": "",
 "stars": 27,
 "pushed_at": "2026-09-10T06:55:31Z",
 "skill_count": 1,
 "category": "dev",
 "fun_score": 1.29,
 "pick": false,
 "hide": true,
 "source": "daily-scout",
 "added_at": "2026-08-22",
 "install": {
  "clone": "git clone --depth 1 https://github.com/jmanhype/claude-code-plugin-marketplace.git",
  "copy": "cp -r claude-code-plugin-marketplace/plugins/ace-context-engineering/skills/curate-delta ~/.claude/skills/curate-delta",
  "dir": "~/.claude/skills/curate-delta"
 }
}