{
 "id": "arbiterforge-codearbiter",
 "kind": "collection",
 "name": "codeArbiter",
 "title_zh": "代码仲裁官",
 "tagline_zh": "改代码改到怀疑人生？让 Arbiter 当裁判——它不写码，只挑刺，专治“我觉得没问题”和“上次还能跑”的迷之自信。",
 "tagline_en": "When your code lies to you, Arbiter tells the truth. It doesn't fix—it judges, catching the 'works on my machine'.",
 "desc_en": "When you can't trust yourself with your code base, trust Arbiter.",
 "why_zh": "同类工具只会报错，它直接给代码库“判刑”——基于历史提交和运行痕迹定位自欺点，比代码审查更懂你的坏习惯。",
 "why_en": "Unlike linters that flag syntax, it profiles your commit history and runtime traces to expose self-deception patterns—a.",
 "repo": "arbiterForge/codeArbiter",
 "owner": "arbiterForge",
 "path": "",
 "url": "https://github.com/arbiterForge/codeArbiter",
 "homepage": "https://codeArbiter.dev",
 "stars": 142,
 "pushed_at": "2026-09-08T11:27:24Z",
 "skill_count": 62,
 "category": "dev",
 "fun_score": 1.94,
 "pick": false,
 "hide": true,
 "source": "daily-scout",
 "added_at": "2026-08-08",
 "install": {
  "clone": "git clone --depth 1 https://github.com/arbiterForge/codeArbiter.git",
  "copy": "",
  "dir": "",
  "browse": "https://github.com/arbiterForge/codeArbiter/tree/HEAD/plugins",
  "note": "clone 下来，挑你要的那件复制进 ~/.claude/skills/。这是一个合集，没有「装它」这个动作。"
 },
 "unshelve_reason": "问一 · 框架不是商品。每件 skill 开头写「Read these, or STOP」，读的是 .codearbiter/ 那套不随 skill 走的项目档案。另：171 份里 4 份是 site/test/fixtures 测试夹具，印出来的数量本身不实。",
 "unshelved_at": "2026-08-19"
}