{
 "id": "muselinn-nature-ref-verifier",
 "kind": "skill",
 "name": "nature-ref-verifier",
 "title_zh": "",
 "tagline_zh": "写代码的顺手工具：nature-ref-verifier。英文简介见下。",
 "tagline_en": "",
 "desc_en": "Drop in a whole bibliography: author order, volume, issue and page numbers get cross-checked against several databases, then graded red, amber or green.",
 "why_zh": "",
 "why_en": "",
 "limit_zh": "",
 "limit_en": "",
 "repo": "MuseLinn/nature-ref-verifier",
 "owner": "MuseLinn",
 "path": "",
 "url": "https://github.com/MuseLinn/nature-ref-verifier",
 "homepage": "",
 "stars": 1,
 "pushed_at": "2026-07-06T04:37:50Z",
 "skill_count": 1,
 "category": "docs",
 "fun_score": 0.0,
 "pick": false,
 "hide": true,
 "source": "cocoloop",
 "added_at": "2026-08-21",
 "install": {
  "clone": "git clone --depth 1 https://github.com/MuseLinn/nature-ref-verifier.git",
  "copy": "mv nature-ref-verifier ~/.claude/skills/nature-ref-verifier",
  "dir": "~/.claude/skills/nature-ref-verifier"
 }
}