{
 "id": "kkkkhazix-khazix-skills-storage-analyzer",
 "kind": "skill",
 "name": "storage-analyzer",
 "title_zh": "磁盘侦探",
 "tagline_zh": "电脑又满又卡？别急着删，先让磁盘侦探扫一遍。它把占空间大户分绿黄红三级，给出可执行方案，还能一键生成可折叠。",
 "tagline_en": "Disk full? Let this read-only detective scan, sort space hogs into green/yellow/red, and hand you a clickable.",
 "desc_en": "macOS / Windows 只读存储分析助手（自动识别系统）。扫描整机磁盘占用，找出 占空间大户，把每一项分成 🟢可自动清理 / 🟡需人工判断 / 🔴谨慎清理 三级并给出 可执行处置方案，生成排版精美、可折叠、命令可一键复制的交互式 HTML 报告，并可 起本地服务在网页上一键删除（移废纸篓/直接删）。扫描全程只读。务必在以下场景 使用：用户说\"存储分析\"\"磁盘满了\"\"C盘/硬盘满了\"\"空间不够\"\"清理空间\" \"清理磁盘\"\"占空间\"\"哪些东西占地方\"\"帮我看看存储\"\"看一下电脑存储/空间\" \"存储空间\"\"电脑空间不够\"\"内存满了/不够/不足\"\"看下内存/存储\"（中文口语里 \"内存\"常指存储空间）\"storage analysis\"\"disk cleanup\"\"清缓存\"\"磁盘清理\"； 或用户抱怨电脑没空间、想知道什么东西吃硬盘、想要清理建议时。注意：若用户明确 指运行内存/RAM（如\"哪",
 "why_zh": "同类工具只报数字，它直接给处置方案，还按风险分级，连删除命令都备好，真敢让你动手。",
 "why_en": "Unlike tools that just list files, it triages by risk, suggests actions, and even prepares delete commands—so you can safely.",
 "repo": "KKKKhazix/khazix-skills",
 "owner": "KKKKhazix",
 "path": "storage-analyzer",
 "url": "https://github.com/KKKKhazix/khazix-skills/tree/HEAD/storage-analyzer",
 "homepage": "",
 "stars": 20487,
 "pushed_at": "2026-08-16T08:49:13Z",
 "skill_count": 1,
 "category": "dev",
 "fun_score": 3.88,
 "pick": false,
 "hide": false,
 "source": "handpick-0807",
 "added_at": "2026-08-07",
 "install": {
  "clone": "git clone --depth 1 https://github.com/KKKKhazix/khazix-skills.git",
  "copy": "cp -r khazix-skills/storage-analyzer ~/.claude/skills/storage-analyzer",
  "dir": "~/.claude/skills/storage-analyzer"
 }
}