{
 "id": "adrianpunk-punk-redskill-forge",
 "kind": "skill",
 "name": "punk-redskill-forge",
 "title_zh": "",
 "tagline_zh": "打工人的外挂：punk-redskill-forge。英文简介见下。",
 "tagline_en": "",
 "desc_en": "将一个 Skill 整理为适合上传小红书 REDSkill 的独立副本，生成安全审计、提交字段和上传 ZIP。适用于用户提供链接、文件夹或 ZIP；不可用于自动运营小红书账号。",
 "why_zh": "",
 "why_en": "",
 "limit_zh": "",
 "limit_en": "",
 "repo": "adrianpunk/Punk-REDSkill-Forge",
 "owner": "adrianpunk",
 "path": "",
 "url": "https://github.com/adrianpunk/Punk-REDSkill-Forge",
 "homepage": "",
 "stars": 10,
 "pushed_at": "2026-09-06T18:18:54Z",
 "skill_count": 1,
 "category": "work",
 "fun_score": 0.9,
 "pick": false,
 "hide": true,
 "source": "human-suggested",
 "added_at": "2026-08-23",
 "install": {
  "clone": "git clone --depth 1 https://github.com/adrianpunk/Punk-REDSkill-Forge.git",
  "copy": "mv Punk-REDSkill-Forge ~/.claude/skills/punk-redskill-forge",
  "dir": "~/.claude/skills/punk-redskill-forge"
 }
}