{
 "id": "anthropics-skills-docx",
 "kind": "skill",
 "name": "docx",
 "title_zh": "文档巧手",
 "tagline_zh": "Word 文件改到崩溃？它直接读写 .docx/.dotx，目录、页眉、页码一键生成，还能从旧文档里抽内容重组。",
 "tagline_en": "Tired of fighting Word? This skill reads, writes, and edits .docx/.dotx directly—TOC, headers, page numbers, even.",
 "desc_en": "Use this skill whenever the user wants to create, read, edit, or manipulate Word documents (.docx files) or Word templates (.dotx files). Triggers include: any mention of 'Word doc', 'word document', '.docx', '.dotx', or requests to produce professional documents with formatting like tables of contents, headings, page numbers, or letterheads. Also use when extracting or reorganizing content from .",
 "why_zh": "同类只会转文本，它保留样式结构，能改模板、抽内容重组，是唯一直接操作 Word 原生格式的 skill。",
 "why_en": "Unlike text-only converters, it edits native .docx/.dotx preserving styles—templates, extraction, remix. The only skill that.",
 "repo": "anthropics/skills",
 "owner": "anthropics",
 "path": "skills/docx",
 "url": "https://github.com/anthropics/skills/tree/HEAD/skills/docx",
 "homepage": "",
 "stars": 174910,
 "pushed_at": "2026-09-03T16:37:14Z",
 "skill_count": 1,
 "category": "docs",
 "fun_score": 4.5,
 "pick": false,
 "hide": false,
 "source": "seed",
 "added_at": "2026-08-07",
 "install": {
  "clone": "git clone --depth 1 https://github.com/anthropics/skills.git",
  "copy": "cp -r skills/skills/docx ~/.claude/skills/docx",
  "dir": "~/.claude/skills/docx"
 },
 "cover": "https://skills.sh/b/anthropics/skills"
}