{
 "id": "phuryn-pm-skills-north-star-metric",
 "kind": "skill",
 "name": "north-star-metric",
 "title_zh": "北极星指标",
 "tagline_zh": "团队指标各说各话？用北极星+3-5个输入指标定方向，先辨业务游戏类型，再按7条标准验证，避免拍脑袋选错。",
 "tagline_en": "Tired of misaligned metrics? Define a North Star plus 3-5 inputs, classify your game (Attention, Transaction.",
 "desc_en": "Define a North Star Metric and 3-5 supporting input metrics that form a metrics constellation. Classify the business game (Attention, Transaction, Productivity) and validate against 7 criteria for an effective North Star. Use when choosing a North Star Metric, setting up a metrics framework, learning about the North Star Framework, or deciding what to measure.",
 "why_zh": "它把选指标变成可复用的决策流程，先定游戏类型再验证，比拍脑袋或抄竞品更靠谱。",
 "why_en": "Turns metric selection into a repeatable process: classify your game first, then validate—more reliable than gut feel or copying.",
 "repo": "phuryn/pm-skills",
 "owner": "phuryn",
 "path": "pm-marketing-growth/skills/north-star-metric",
 "url": "https://github.com/phuryn/pm-skills/tree/HEAD/pm-marketing-growth/skills/north-star-metric",
 "homepage": "",
 "stars": 26141,
 "pushed_at": "2026-07-03T11:34:49Z",
 "skill_count": 1,
 "category": "docs",
 "fun_score": 8.98,
 "pick": false,
 "hide": false,
 "source": "handpick-0807",
 "added_at": "2026-08-07",
 "install": {
  "clone": "git clone --depth 1 https://github.com/phuryn/pm-skills.git",
  "copy": "cp -r pm-skills/pm-marketing-growth/skills/north-star-metric ~/.claude/skills/north-star-metric",
  "dir": "~/.claude/skills/north-star-metric"
 }
}