{
 "id": "simota-image-skills-image-refine",
 "kind": "skill",
 "name": "image-refine",
 "title_zh": "",
 "tagline_zh": "让 Claude 帮你搞创作：image-refine。英文简介见下。",
 "tagline_en": "",
 "desc_en": "Changing an image that already exists: regenerate, edit a region, remove an object, extend the canvas, upscale, and iterate. Use when a result is close but wrong.",
 "why_zh": "",
 "why_en": "",
 "limit_zh": "",
 "limit_en": "",
 "repo": "simota/image-skills",
 "owner": "simota",
 "path": "skills/image-refine",
 "url": "https://github.com/simota/image-skills/tree/HEAD/skills/image-refine",
 "homepage": "",
 "stars": 1,
 "pushed_at": "2026-09-02T12:38:54Z",
 "skill_count": 1,
 "category": "creative",
 "fun_score": 1.0,
 "pick": false,
 "hide": true,
 "source": "human-suggested",
 "added_at": "2026-08-24",
 "install": {
  "clone": "git clone --depth 1 https://github.com/simota/image-skills.git",
  "copy": "cp -r image-skills/skills/image-refine ~/.claude/skills/image-refine",
  "dir": "~/.claude/skills/image-refine"
 }
}